{
  "$schema": "https://json-schema.org/draft/2020-12/schema",
  "$id": "https://fde.local/schemas/events/cloudevent.schema.json",
  "title": "FDE CloudEvent",
  "type": "object",
  "required": [
    "specversion",
    "id",
    "source",
    "type",
    "subject",
    "time",
    "datacontenttype",
    "correlation_id",
    "trace_id",
    "run_id",
    "application",
    "environment",
    "data"
  ],
  "additionalProperties": false,
  "properties": {
    "specversion": { "const": "1.0" },
    "id": { "type": "string", "minLength": 1 },
    "source": {
      "type": "string",
      "enum": ["gitlab", "tekton", "argocd", "kubernetes", "feishu", "compliance", "pipeline", "diagnosis", "collaboration", "knowledge", "gitops"]
    },
    "type": {
      "type": "string",
      "enum": [
        "compliance.environment.scan.requested",
        "compliance.environment.scan.completed",
        "compliance.environment.scan.failed",
        "gitlab.mr.created",
        "gitlab.mr.updated",
        "gitlab.mr.comment.created",
        "gitlab.mr.merged",
        "gitlab.pipeline.completed",
        "tekton.pipelinerun.started",
        "tekton.pipelinerun.completed",
        "tekton.taskrun.completed",
        "pipeline.build.completed",
        "pipeline.deployment.failed",
        "gitops.yaml.updated",
        "argocd.application.sync.requested",
        "argocd.application.synced",
        "argocd.application.degraded",
        "kubernetes.pod.failed",
        "kubernetes.node.unhealthy",
        "diagnosis.context.built",
        "diagnosis.rule.matched",
        "diagnosis.rule.missed",
        "diagnosis.knowledge.matched",
        "diagnosis.knowledge.missed",
        "diagnosis.completed",
        "knowledge.case.candidate",
        "collaboration.notification.requested",
        "collaboration.notification.sent",
        "collaboration.notification.failed",
        "collaboration.notification.timeout",
        "collaboration.progress.updated",
        "collaboration.escalation.triggered",
        "collaboration.daily_report.generated",
        "feishu.card.action_clicked",
        "feishu.message.replied"
      ]
    },
    "subject": { "type": "string", "minLength": 1 },
    "time": { "type": "string", "format": "date-time" },
    "datacontenttype": { "const": "application/json" },
    "correlation_id": { "type": "string", "minLength": 1 },
    "trace_id": { "type": "string", "minLength": 1 },
    "run_id": { "type": "string", "minLength": 1 },
    "application": { "type": "string", "minLength": 1 },
    "environment": { "$ref": "../common/environment.schema.json" },
    "data": { "type": "object" },
    "metadata": { "$ref": "../common/metadata.schema.json" }
  }
}
